{
  "schema_version": "1.0",
  "mpv_version": "0.41.0",
  "architecture": "x86_64",
  "target_triple": "x86_64-w64-mingw32",
  "upstream_repository": "https://github.com/mpv-player/mpv",
  "upstream_tag": "v0.41.0",
  "upstream_commit": "g41f6a6450",
  "artifact_provider": "mpv-first-party-github-ci",
  "artifact_filename": "mpv-v0.41.0-x86_64-w64-mingw32.zip",
  "artifact_url": "https://github.com/mpv-player/mpv/releases/download/v0.41.0/mpv-v0.41.0-x86_64-w64-mingw32.zip",
  "artifact_sha256": "a49811c0752c108b8260636f9c6f6fcb97406641c98b30f1e7b500dfb20177de",
  "files": [
    {
      "path": "avcodec-62.dll",
      "sha256": "DA6E88180C23D5F27593364C781F9F4FBC62DD6305563FB15B97BA0AD4C82289"
    },
    {
      "path": "avdevice-62.dll",
      "sha256": "C4C7376AACBBBF0567627B4665E0C529DCFB31E3B10BEEA56E776CF7722EE6C2"
    },
    {
      "path": "avfilter-11.dll",
      "sha256": "62D619AB392A134EB40792C30F16FF823418B649E2F7A307FD11807DF3CCFE4E"
    },
    {
      "path": "avformat-62.dll",
      "sha256": "5A6E1752485017773435658453B1EBA769542FBF7F6F451D804A0F92A74F1DD3"
    },
    {
      "path": "avutil-60.dll",
      "sha256": "A1B0530106DD5A0292D183A3A9FD9A5817754FA532BB0DCDE3A24A98E0BA561A"
    },
    {
      "path": "libass-9.dll",
      "sha256": "5BD64A6EC88F00FE8E2B17E713E35D825DAD023A516423DCF6B068F5470FFEE5"
    },
    {
      "path": "libdav1d.dll",
      "sha256": "C6586274D646D68AB81830005B9B4AFC3FDC3B8EADA229DD6D6918D38FA59AB7"
    },
    {
      "path": "libfreetype-6.dll",
      "sha256": "CE7309487DB8BADEB4C52CA9C5D9B90C12CF8D18734C67E4B8D87F8D046955D7"
    },
    {
      "path": "libfribidi-0.dll",
      "sha256": "B788D4E865FDD6CBC39CB3D89D5BA04D8039D58B4BED345090196E8E5077B054"
    },
    {
      "path": "libgcc_s_seh-1.dll",
      "sha256": "306983C483D96A6D08A2DF044E360F0962E21DAC021BAF8311D3C0CB3B2C9DEF"
    },
    {
      "path": "libharfbuzz-0.dll",
      "sha256": "007D4832F00E370FAD9A255B5F83C6746E8CC77E210BE8781BF6791BD245205C"
    },
    {
      "path": "libiconv-2.dll",
      "sha256": "C5DAADC6C8021FA6759B106D14B733EA2A10CF91D3E9AE0EEAD2A04274C5A184"
    },
    {
      "path": "liblcms2.dll",
      "sha256": "94E5B99D06E5F1B0BC637C65D8FE736E21C898078B2D91267F93E8A6DBD64900"
    },
    {
      "path": "libplacebo-358.dll",
      "sha256": "5BD638535A1350803EBB371FB1AE76EBC9324F546AD67E7A1C38CDED870DCD20"
    },
    {
      "path": "libshaderc_shared.dll",
      "sha256": "326385A111F15DB45819FACABCD46714BF270D95F2095CFFD4D29A19C443888A"
    },
    {
      "path": "libspirv-cross-c-shared.dll",
      "sha256": "0D18BE367A9C4A6250AE5DDAF04201D4B01B9C5890E633679216FDCCCB43ADA7"
    },
    {
      "path": "libssp-0.dll",
      "sha256": "0B4CF4B0A5F4CEB08BC2B95E7837B72CE24C2A5E906C93EDD2661FACBCFE5173"
    },
    {
      "path": "libstdc++-6.dll",
      "sha256": "DC04A17D6E9FE93BCB0639E93ACA2811AD53C81C523E1909A2C24DAF827FD2CD"
    },
    {
      "path": "libwinpthread-1.dll",
      "sha256": "FC9F14551F6609DD51801DAEC2C194579D35345551EF84FE465CBDB3339C2A6F"
    },
    {
      "path": "mpv-register.bat",
      "sha256": "E3C354D13BFE4AE2B9BAFBD1B7609753C47F78A3A4989B082F34D5A938AA7A09"
    },
    {
      "path": "mpv-unregister.bat",
      "sha256": "D40F2F76E00E08287C39C15654E9350831E4418F1BD9619BC8DCFF0DFB055E91"
    },
    {
      "path": "mpv.com",
      "sha256": "86F720F6516A7B29B35CA4D9470A60541EECAEE085AB46C154ABCE4797867FA1"
    },
    {
      "path": "mpv.exe",
      "sha256": "3AD8364B572BFFC7980C5C4BB11B952B2DD2429C203971EBED890D214B6E07C1"
    },
    {
      "path": "swresample-6.dll",
      "sha256": "4214C5EF1F091218D2EB1554D769625E7F918AF5AFD6F518804AF1C61C058111"
    },
    {
      "path": "swscale-9.dll",
      "sha256": "75F9A2979BE77B3F1606A73C9C383BA46235030A9FE7C9327F944D2B1F5F787C"
    },
    {
      "path": "vulkan-1.dll",
      "sha256": "B2C068A078D86A6DF7F55A04634699A7656B09EE4F701C121E1DDBE6E98D77A3"
    },
    {
      "path": "zlib1.dll",
      "sha256": "F66DE1D6324848C68BB45A808882E396CEE910B0C561E848BEE9ED26558A3A50"
    }
  ],
  "build_information": {
    "provider": "MPV 官方 GitHub Actions CI",
    "built_by": "mpv-player/mpv 官方 release 流程",
    "mpv_self_reported": "v0.41.0-dev-g41f6a6450 (built on Dec 21 2025)"
  },
  "acquired_at": "2026-08-01",
  "configuration_version": "mpv-runtime-config-2026-09-28-r21",
  "distribution_status": "development-only",
  "notes": "压缩包 SHA-256 来自 MPV 官方发布页，未在本机对原始 ZIP 重新计算；已对当前 27 个解压文件逐个计算并记录 SHA-256。upstream_commit 为 mpv.com --version 报告的构建短哈希，完整上游 SHA 未另行核对。第三方许可证与发布材料尚未完成，仅限本地开发使用。2026-08-10 新增播放器增强组件（uosc/thumbfast/Anime4K），来源、版本、SHA-256 与许可证统一记录于 components-manifest.json；配置版本随配置源变化更新。2026-08-10-r2 精简 Anime4K 菜单、增强 uosc 时间轴可读性并启用安全硬件解码回退。2026-08-10-r5 屏蔽 Ctrl+v 剪贴板加载，防止绕过受控队列；保留 mpv 官方默认键位。2026-08-10-r6 接入 mpv-stats.lua 中文翻译版（load-stats-overlay=no + scripts/stats.lua），许可证材料已补齐全套（mpv-stats-zh/LICENSE.md、mpv-v0.41.0/LICENSE.GPL/LGPL），mpv-stats-zh 的 README 与 LICENSE 矛盾仍在发布前复核清单中。2026-08-10-r8 切换完全自定义键位方案：input-builtin-bindings=no + input.conf 显式绑定，播放控制与画质调节键位已按旧整合包布局恢复（44 binds，r9）。2026-08-12-r12 分层架构：kumiplayer/ 自有层（脚本+强制配置）与 portable_config/ 可替换层分离，后端 --include/--script 加载，校验改自有层。r13 文档全面治理；r14 禁用 mpv 原生 OSD 进度条（演进记录重构/入口文档重写/快捷键表修正）。2026-09-16-r15 修复右键菜单 uosc 探测（`script-names` 属性在 mpv v0.41.0 不存在，恒为 nil，导致菜单被无条件跳过；改用 input-bindings 的 owner 与 uosc-version 广播双通道，失败结果不缓存），并关闭 uosc 暂停指示器（pause_indicator=no）。2026-09-21-r16 配置审校（以第三方整合包为参照、逐项按 mpv v0.41.0 真实选项表核实）：portable_config 补充字幕自动挂载策略（sub-auto=fuzzy、中文优先 slang、subs-with-matching-audio=no）与 network 缓冲实验（同日试过 cache=yes，因针对性实测拿不出收益证据已回退，保持 mpv 默认 cache=auto）；kumiplayer 自有层新增 directory-mode=ignore（受控队列安全边界，与 Ctrl+v 屏蔽、--autocreate-playlist=no 构成三层防护）；script-opts/uosc.conf 补充章节范围中文模式 chapter_range_patterns。同日修复 Anime4K 永久默认值失效：后端 script-opt 键名由点号改为短横（mp.options 按 `<脚本名>-` 匹配，点号会被静默忽略），kumiplayer_anime4k.lua 改用 mp.options.read_options 读取（原先 mp.get_opt 裸键永远取不到值）；thumbfast 缩略图缓存目录注入同因点号失效，一并恢复。同日修复三项播放回归：input.conf 补齐旧整合包同款的纯 mpv 内置键位（38→58 条，绑定总数 60→80，根因是 input-builtin-bindings=no 下未显式声明的单键全部无反应）；新增 _strip_dwm_border() 去掉 Windows 11 给无边框窗口画的 1px 白边（窗口样式 0x140E0000、DwmSetWindowAttribute 返回 S_OK，该属性本机构建不支持 GET 故需真机肉眼确认），并设 uosc window_border_size=0 关闭 uosc 自身那圈 1px 黑边；kumiplayer_anime4k.lua 的基础 shader 列表改为只记录一次（原实现会把上一轮追加的 Anime4K 链误当基础，导致关闭后链残留），并用 applied_key 避免每次切集重复 clr+append；移除实测无效的模拟 Alt 键聚焦手法。2026-09-22-r17 修复字幕不自动读取：`slang` 由含 ja/jp 的列表改为 `zh,zh-cn,zh-hans,zh-hant,zh-tw,zh-hk,sc,tc,chs,cht,en`。实测根因是 `slang` 一旦命中**音轨语言**（动画原声日语）而字幕里没有该语言，mpv 会一条字幕都不选（sid=no）；用 3 集真实素材验证修复后 sid=1、.sc.ass 被选中。同轮实测确认鼠标中键全屏与 uosc 右上角窗口按钮（cycle window-maximized / window-minimized / fullscreen）在当前窗口配置下均正常，无需改动。2026-09-22-r18 对照 MPVlite 整合包优化交互手感：portable_config 新增网盘/挂载盘读缓冲四件套（cache=yes、demuxer-readahead-secs=5、demuxer-max-bytes=1000MiB、demuxer-max-back-bytes=100MiB，更正了 r16 时基于本地合成素材得出的「cache=yes 无收益」结论）与 keepaspect-window=no（无边框窗口自由缩放，不再吸附视频宽高比）；script-opts/thumbfast.conf 的 spawn_first 由 no 改为 yes（悬停时间轴预览不再等后端进程启动），并清掉该文件里重复声明的 quit_after_inactivity。2026-09-24-r19 MPV 文件统一到项目根 mpv/ 目录：原 third_party/mpv/（二进制、清单、许可证）与 resources/mpv-runtime/（配置源）合并为 mpv/{runtime,config,licenses,docs}/，third_party/ 与 resources/ 两个目录已不存在；Anime4K 着色器由可替换层 portable_config/shaders/ 迁入自有层 config/kumiplayer/shaders/（原先 kumiplayer_anime4k.lua 用 ~~/shaders/ 解析，替换 portable_config 整合包后会指错，故改为后端 --script-opt=kumiplayer_anime4k-shaders_dir 注入绝对路径）；components-manifest.json 随包文件路径同步；安装包布局 packaging/runtime/mpv/ 不变。本次仅改动注释、路径与脚本选项注入，未变更任何二进制文件。"
}
